{
  "$schema": "https://tifms160iotstoragehubdev.blob.core.windows.net/schemas/telemetriesBundle.schema.v1.json",
  "deviceId": "",
  "moduleId": "",
  "messageDateTime": "2022-04-17T14:30:00Z",
  "messageType": "telemetry",
  "batteryLevels": [
    {
      "batteryId": "",
      "batteryLevel": 0,
      "batteryLevelDateTime": "2022-04-17T14:30:00Z"
    },
    {
      "batteryId": "",
      "batteryLevel": 0,
      "batteryLevelDateTime": "2022-04-17T14:30:00Z"
    }
  ],
  "tankLevels": [
    {
      "tankId": "",
      "tankLevel": 0,
      "tankLevelDateTime": "2022-04-17T14:30:00Z"
    },
    {
      "tankId": "",
      "tankLevel": 0,
      "tankLevelDateTime": "2022-04-17T14:30:00Z"
    }
  ],
  "position": {
    "latitude": 0,
    "longitude": 0,
    "positionDateTime": "2022-04-17T14:30:00Z"
  },
  "status": {
    "status": "online",
    "statusDateTime": "2022-04-17T14:30:00Z"
  }
}
